{
  "$schema": "https://json-schema.org/draft/2020-12/schema",
  "type": "object",
  "required": [
    "assetId",
    "schemaVersion",
    "contentVersion",
    "schema",
    "authorityClass",
    "ownerContract",
    "review",
    "primarySection",
    "sections"
  ],
  "properties": {
    "assetId": {
      "const": "ability-model"
    },
    "description": {
      "type": "string",
      "minLength": 1
    },
    "schemaVersion": {
      "type": "integer",
      "minimum": 1
    },
    "contentVersion": {
      "type": "string",
      "minLength": 1
    },
    "schema": {
      "const": "schema.json"
    },
    "authorityClass": {
      "enum": [
        "reference_dataset",
        "curated_knowledge_asset",
        "design_asset"
      ]
    },
    "ownerContract": {
      "type": "string",
      "minLength": 1
    },
    "generatedModule": {
      "type": "string",
      "minLength": 1
    },
    "runtimeProjectionAdmission": {
      "type": "string",
      "minLength": 1
    },
    "review": {
      "type": "object",
      "required": [
        "status",
        "owner",
        "reviewer",
        "lastReviewedAt"
      ],
      "properties": {
        "status": {
          "enum": [
            "reviewed",
            "needs_review",
            "rejected"
          ]
        },
        "owner": {
          "type": "string",
          "minLength": 1
        },
        "reviewer": {
          "type": [
            "string",
            "null"
          ]
        },
        "lastReviewedAt": {
          "type": [
            "string",
            "null"
          ],
          "pattern": "^\\d{4}-\\d{2}-\\d{2}$"
        }
      },
      "additionalProperties": false
    },
    "sources": {
      "type": "array",
      "minItems": 1,
      "items": {
        "type": "object",
        "required": [
          "sourceId",
          "citation",
          "url",
          "retrievedAt",
          "licenseClass",
          "sourceClass",
          "reviewStatus"
        ],
        "properties": {
          "sourceId": {
            "type": "string",
            "minLength": 1
          },
          "citation": {
            "type": "string",
            "minLength": 1
          },
          "url": {
            "type": [
              "string",
              "null"
            ]
          },
          "retrievedAt": {
            "type": "string",
            "pattern": "^\\d{4}-\\d{2}-\\d{2}$"
          },
          "licenseClass": {
            "enum": [
              "public_standard",
              "open_reference",
              "internal_curated",
              "unknown_review_required"
            ]
          },
          "sourceClass": {
            "enum": [
              "clinical_reference",
              "educational_reference",
              "curated_parentos",
              "design_reference"
            ]
          },
          "reviewStatus": {
            "enum": [
              "reviewed",
              "needs_review",
              "rejected"
            ]
          }
        },
        "additionalProperties": false
      }
    },
    "primarySection": {
      "type": "string",
      "minLength": 1
    },
    "sections": {
      "type": "array",
      "minItems": 1,
      "items": {
        "type": "object",
        "required": [
          "sectionId",
          "kind",
          "files",
          "ordering",
          "orphanPolicy"
        ],
        "properties": {
          "sectionId": {
            "type": "string",
            "minLength": 1
          },
          "kind": {
            "enum": [
              "collection",
              "map",
              "singleton"
            ]
          },
          "files": {
            "anyOf": [
              {
                "type": "string",
                "minLength": 1
              },
              {
                "type": "array",
                "minItems": 1,
                "items": {
                  "type": "string",
                  "minLength": 1
                }
              },
              {
                "type": "object",
                "minProperties": 1,
                "additionalProperties": {
                  "type": "string",
                  "minLength": 1
                }
              }
            ]
          },
          "idField": {
            "type": "string",
            "minLength": 1
          },
          "ordering": {
            "enum": [
              "manifest",
              "idField-asc",
              "idField-desc",
              "key-asc"
            ]
          },
          "orphanPolicy": {
            "const": "fail_close"
          },
          "references": {
            "type": "array",
            "minItems": 1,
            "items": {
              "type": "object",
              "required": [
                "fromSection",
                "fromField",
                "toSection",
                "toField"
              ],
              "properties": {
                "fromSection": {
                  "type": "string",
                  "minLength": 1
                },
                "fromField": {
                  "type": "string",
                  "minLength": 1
                },
                "toAsset": {
                  "type": "string",
                  "minLength": 1
                },
                "toSection": {
                  "type": "string",
                  "minLength": 1
                },
                "toField": {
                  "type": "string",
                  "minLength": 1
                },
                "ownerContract": {
                  "type": "string",
                  "minLength": 1
                }
              },
              "additionalProperties": false
            }
          }
        },
        "additionalProperties": false,
        "allOf": [
          {
            "if": {
              "properties": {
                "kind": {
                  "const": "collection"
                }
              },
              "required": [
                "kind"
              ]
            },
            "then": {
              "required": [
                "idField"
              ]
            }
          }
        ]
      }
    }
  },
  "additionalProperties": false,
  "x-parentos-sectionSchemas": {
    "field_contract": {
      "type": [
        "object",
        "array"
      ]
    },
    "constraints": {
      "type": [
        "object",
        "array"
      ]
    },
    "layerModel": {
      "type": [
        "object",
        "array"
      ]
    },
    "aiAnalysisRules": {
      "type": [
        "object",
        "array"
      ]
    },
    "abilities": {
      "type": "array",
      "items": {
        "type": "object",
        "required": [
          "abilityId"
        ],
        "properties": {
          "abilityId": {
            "type": "string",
            "minLength": 1
          }
        },
        "additionalProperties": true
      }
    }
  },
  "allOf": [
    {
      "if": {
        "properties": {
          "authorityClass": {
            "const": "reference_dataset"
          }
        },
        "required": [
          "authorityClass"
        ]
      },
      "then": {
        "required": [
          "sources"
        ]
      }
    },
    {
      "if": {
        "properties": {
          "authorityClass": {
            "const": "design_asset"
          }
        },
        "required": [
          "authorityClass",
          "generatedModule"
        ]
      },
      "then": {
        "required": [
          "runtimeProjectionAdmission"
        ]
      }
    }
  ]
}
