{
  "assetId": "ability-model",
  "description": "Composable ability-model knowledge asset. Scripts assemble these shards into the same logical data shape consumed by generated runtime constants.",
  "schemaVersion": 1,
  "contentVersion": "2026-05-03.1",
  "schema": "schema.json",
  "authorityClass": "design_asset",
  "ownerContract": "app-shell-contract.md#PO-SHELL-011",
  "review": {
    "status": "needs_review",
    "owner": "parentos",
    "reviewer": null,
    "lastReviewedAt": null
  },
  "primarySection": "abilities",
  "sections": [
    {
      "sectionId": "field_contract",
      "kind": "singleton",
      "files": "field-contract.json",
      "ordering": "manifest",
      "orphanPolicy": "fail_close"
    },
    {
      "sectionId": "constraints",
      "kind": "singleton",
      "files": "constraints.json",
      "ordering": "manifest",
      "orphanPolicy": "fail_close"
    },
    {
      "sectionId": "layerModel",
      "kind": "singleton",
      "files": "layermodel.json",
      "ordering": "manifest",
      "orphanPolicy": "fail_close"
    },
    {
      "sectionId": "aiAnalysisRules",
      "kind": "singleton",
      "files": "aianalysisrules.json",
      "ordering": "manifest",
      "orphanPolicy": "fail_close"
    },
    {
      "sectionId": "abilities",
      "kind": "collection",
      "files": [
        "abilities/po-abl-relq-001.json",
        "abilities/po-abl-logic-001.json",
        "abilities/po-abl-expr-001.json",
        "abilities/po-abl-judg-001.json",
        "abilities/po-abl-mcog-001.json",
        "abilities/po-abl-ques-001.json",
        "abilities/po-abl-xfer-001.json",
        "abilities/po-abl-agnc-001.json",
        "abilities/po-abl-colb-001.json"
      ],
      "ordering": "manifest",
      "orphanPolicy": "fail_close",
      "idField": "abilityId"
    }
  ]
}
